{
  "schema_version": "1.0.0",
  "concordance_id": "MF-FC-NS-CI-001-CONCORDANCE",
  "campaign_id": "NS-CI-001",
  "source_lock_id": "MF-FORMAL-FC-GDM-001-LOCK",
  "snapshot_id": "MF-FORMAL-SNAPSHOT-FC-GDM-001-RH-NS-PILOT",
  "upstream_statement": {
    "repository": "google-deepmind/formal-conjectures",
    "commit": "85f863718beeec7b58a3a1926ee92e3472bc2020",
    "theorem": "NavierStokes.navier_stokes_existence_and_smoothness_R3",
    "module": "FormalConjectures.Millenium.NavierStokes",
    "path": "FormalConjectures/Millenium/NavierStokes.lean",
    "git_blob_sha1": "6fd45b55c78e49ec79f45f4e226a9b9f71f57a81"
  },
  "programme_target": {
    "repository": "grandchallenge/MATH-PROGRAMME",
    "commit": "d94e3f4a622fab73e569a17f005f153f1627235a",
    "paths": [
      "campaigns/navier_stokes",
      "reviews/navier_stokes",
      "https://github.com/grandchallenge/MATH-PROGRAMME/issues/55"
    ],
    "summary": "For every Leray-Hopf solution generated by smooth divergence-free rapidly decaying data on R3, the critical integral of the fourth power of the L6 norm is finite on every finite time interval."
  },
  "relation": "one-way-implication",
  "relation_direction": "programme-to-upstream",
  "equivalence_basis": "programme-audit",
  "review_state": "reviewed",
  "status_authority": {
    "authority": "grandchallenge/MATH-PROGRAMME",
    "upstream_category_is_advisory": true,
    "statement": "MATH-PROGRAMME retains target, status, and promotion authority. The upstream Clay statement is a formulation source, not the NS-CI campaign definition."
  },
  "findings": [
    {
      "finding_id": "NS-FC-001",
      "severity": "info",
      "summary": "The upstream theorem formalizes Clay alternative A for global smooth existence on R3 with positive viscosity and zero forcing.",
      "evidence": [
        "FormalConjectures/Millenium/NavierStokes.lean:navier_stokes_existence_and_smoothness_R3",
        "FormalConjectures/Millenium/NavierStokes.lean:InitialVelocityConditionDecay"
      ]
    },
    {
      "finding_id": "NS-FC-002",
      "severity": "caution",
      "summary": "NS-CI-001 is not the upstream theorem: it quantifies over Leray-Hopf solutions and asserts a critical spacetime integrability condition.",
      "evidence": [
        "https://github.com/grandchallenge/MATH-PROGRAMME/issues/55",
        "reports/discovery/ns_ci_001/source_ledger.yaml"
      ]
    },
    {
      "finding_id": "NS-FC-003",
      "severity": "caution",
      "summary": "The admitted relationship is only the Programme-target-to-Clay-A sufficiency direction; no reverse implication is promoted.",
      "evidence": [
        "reports/discovery/ns_ci_001/source_ledger.yaml",
        "provider_manifests/NS-CI-001.json"
      ]
    },
    {
      "finding_id": "NS-FC-004",
      "severity": "blocking",
      "summary": "The upstream Lean file cannot certify the critical-integral route because its open theorem ends with sorry and does not state the Serrin continuation implication.",
      "evidence": [
        "formal_sources/formal_conjectures/snapshots/FC-GDM-001-RH-NS-PILOT.json",
        "FormalConjectures/Millenium/NavierStokes.lean:navier_stokes_existence_and_smoothness_R3"
      ]
    }
  ],
  "obligations": [
    "Retain the Leray-Hopf solution class, data assumptions, time horizon, and L4_t L6_x integral exactly in all NS-CI handoffs.",
    "Prove or source-audit the one-way continuation implication before any theorem-level promotion.",
    "Do not infer the NS-CI target from the existence of an upstream Lean declaration or from successful elaboration with sorry.",
    "Do not promote the reverse implication from Clay alternative A to universal critical integrability."
  ],
  "claim_boundary": "This concordance records a one-way route relationship only. It does not prove critical integrability, global regularity, equivalence with Clay alternative A, or correctness of the upstream open theorem."
}
